{"bindings":{"canonical_parent_manifest_sha256":"ebb1b00109e1eb7799adddd0112cc810add6ececd59421b6022d0660e7b72140","capacity_evidence_sha256":"2363e5795c108186764f098e572388c6bf61185f77ab342c07e1fc61b2ac46d0","coverage_audit_artifact_sha256":"8af18b21afade3cb8d4ac2deae3df49f9d8139683e3850e97e41a02b226e9dd2","coverage_audit_content_sha256":"f507e7c93dc1a1f131d64ca048197b8ba72554275c8e72960fb85d239358fdef","instrument_registry_sha256":"9e78d2db1cebb33d1b1bf328df2dee3ee3ad9f7c3db6b42ae916c9017a0fa733","original_history_manifest_sha256":"33e69e1690e5a8ec4cddab66360dcb4cec5eff5196e8d1873206d7229d6ad9c3","private_execution_artifact_sha256":"3f28de7f21fb15bc89c5d6da8d5af1d8d3f1e48ea81959d24726cc32f83962ad","repair_plan_artifact_sha256":"a98fafe31f5b9383020bab9802d842a80cd1127735f0a641238675bb49da2697","repair_plan_content_sha256":"afad541f79e62675db2688bd5a9246e0d2709f8fdd872f52265608b74aae3441"},"content_sha256":"fb71a2e26afb3b209fda7d44d0d5e1de080e99eb998b8cc33491bf8d9811cea8","contract":"grid.bybit-1m-gap-repair-execution-public/v1","execution_software_identity":"git:5e9d4c11f4d47d51228e0bcd3819bd9701246df2","generated_at_utc":"2026-08-14T11:18:46.523342Z","limitations":["Evidence covers only the exact gaps in the bound private repair plan.","A remaining source gap is not accepted as an absent historical candle.","Replacement publication, catalog registration, and Gate 2 remain separate transitions."],"limits":{"actual_http_requests":1,"missing_minute_count":1,"observed_row_count":0,"planned_max_http_requests":3,"task_count":1,"total_missing_minutes":1},"outcome":{"classification":"source-gap-remains","parent_dataset_mutated":false,"replacement_dataset_published":false,"replacement_eligible":false},"status":"blocked","storage_policy":{"account_data_included":false,"credentials_included":false,"github_commit_eligible":true,"instrument_or_dataset_identifiers_included":false,"market_values_included":false,"minute_timestamps_included":false,"runtime_paths_included":false}}
